"title","link","image"
"जेठ २० गतेसम्म थपियो निषेधाज्ञा, काठमाडौं उपत्यकामा किराना पसल पनि खोल्न नपाइने","https://merolagani.com/NewsDetail.aspx?newsID=71622","https://images.merolagani.com/content/images/load-image.gif"
"थप ३७४९ जनामा कोरोना भाइरस संक्रमण पुष्टि, ५९को मृत्यु","https://merolagani.com/NewsDetail.aspx?newsID=71936","https://images.merolagani.com/content/images/load-image.gif"
"ट्विटरको एक नम्बर ट्रेण्डिङ्गमा पुग्यो कोरिया जान रोकिएका युवाको अभियान","https://merolagani.com/NewsDetail.aspx?newsID=71933","https://images.merolagani.com/content/images/load-image.gif"
"प्रधानमन्त्री ओलीद्वारा पुनः मन्त्रिपरिषद विस्तार, रक्षा मन्त्रालय भने आफैसंग राखे","https://merolagani.com/NewsDetail.aspx?newsID=71931","https://images.merolagani.com/content/images/load-image.gif"
"नेरुडे लघुवित्तको शेयर रजिष्टारमा आरविवि मर्चेन्ट नियुक्त","https://merolagani.com/NewsDetail.aspx?newsID=71927","https://images.merolagani.com/content/images/load-image.gif"
"बिहीबार फेरी घट्यो सुनको भाउ, कतिमा हुँदैछ कारोबार?","https://merolagani.com/NewsDetail.aspx?newsID=71926","https://images.merolagani.com/content/images/load-image.gif"
"महालक्ष्मी लाइफले बीमाशुल्क भुक्तानीको बिलम्व शुल्कमा शत प्रतिशतसम्म छुट दिने","https://merolagani.com/NewsDetail.aspx?newsID=71925","https://images.merolagani.com/content/images/load-image.gif"
"बैंकभन्दा फाइनान्स कम्पनी शेयरमूल्य बढी, यसकारण फाइनान्स कम्पनीको शेयरमूल्यमा आयो ‘उछाल’","https://merolagani.com/NewsDetail.aspx?newsID=71919","https://images.merolagani.com/content/images/load-image.gif"
"जीवन बीमा कम्पनीहरुको लाभांश प्रस्तावमा किन ढिलाई ?","https://merolagani.com/NewsDetail.aspx?newsID=71912","https://images.merolagani.com/content/images/load-image.gif"
"सिईडिबी हाइड्रोपावरको शेयर नेप्सेमा सूचीकृत, ओपनिङ्ग रेन्ज कति ?","https://merolagani.com/NewsDetail.aspx?newsID=71887","https://images.merolagani.com/content/images/load-image.gif"
"अघिल्लाे बुलमा इन्स्योरेन्स सेक्टरले लिड गरेको नेप्सेमा यो बुल कसको?","https://merolagani.com/NewsDetail.aspx?newsID=71852","https://images.merolagani.com/content/images/load-image.gif"
"यस कारण बाणिज्य बैंकको सेयरमा लगानी सबैभन्दा सुरक्षित","https://merolagani.com/NewsDetail.aspx?newsID=71827","https://images.merolagani.com/content/images/load-image.gif"
"युनिलिभरबाट खोसियो सबैभन्दा महँगो शेयरको ताज, कुन कम्पनीले उछिन्याे? किन बढ्याे त्यसकाे मूल्य?","https://merolagani.com/NewsDetail.aspx?newsID=71820","https://images.merolagani.com/content/images/load-image.gif"